{
    "id": "ОК-5487284",
    "title": "Следователи нашли временный пункт дислокации ВСУ в Трехизбенке в ЛНР",
    "platform_id": "ria.ru",
    "platform_name": "ria.ru",
    "external_url": "https://ria.ru/20220413/donbass-1783341942.html?in=t",
    "internal_url": null,
    "markers": [
        "россия",
        "луганская народная республика",
        "украина",
        "следственный комитет россии (ск рф)",
        "в мире",
        "Россия",
        "Луганская Народная Республика",
        "Украина",
        "Следственный комитет России (СК РФ)",
        "В мире"
    ],
    "notes": null,
    "publication_author": "РИА Новости",
    "publication_date_timestamp": 1649864400,
    "publication_date": "2022-04-13 15:40:00",
    "type": "unverified",
    "description": "Военные следователи обнаружили временный пункт дислокации украинских войск в селе Трехизбенка в ЛНР и оставленные там гранатометы NLAW, сообщается в... РИА Новости, 13.04.2022",
    "text": "https://ria.ru/20220413/donbass-1783341942.html\nСледователи нашли временный пункт дислокации ВСУ в Трехизбенке в ЛНР\nСледователи нашли временный пункт дислокации ВСУ в Трехизбенке в ЛНР - РИА Новости, 13.04.2022\nСледователи нашли временный пункт дислокации ВСУ в Трехизбенке в ЛНР\nВоенные следователи обнаружили временный пункт дислокации украинских войск в селе Трехизбенка в ЛНР и оставленные там гранатометы NLAW, сообщается в... РИА Новости, 13.04.2022\n2022-04-13T15:40\n2022-04-13T15:40\n2022-04-13T16:31\nспециальная военная операция на украине\nроссия\nлуганская народная республика\nукраина\nследственный комитет россии (ск рф)\nв мире\n/html/head/meta[@name='og:title']/@content\n/html/head/meta[@name='og:description']/@content\nhttps://cdnn21.img.ria.ru/images/07e6/04/0d/1783356066_0:0:1920:1080_1920x0_80_0_0_454b8e32133f1a70176860e9049d0b86.jpg\nМОСКВА, 13 апр - РИА Новости. Военные следователи обнаружили временный пункт дислокации украинских войск в селе Трехизбенка в ЛНР и оставленные там гранатометы NLAW, сообщается в Telegram-канале СК РФ.\"Сотрудниками военного следственного отдела СК РФ в ходе выезда в населенный пункт Трехизбенка совместно с войсками Народной милиции ЛНР обнаружен временный пункт дислокации войсковой части А4395 (42 отдельный мотопехотный батальон), входящий в состав войсковой части А1736 (57 отдельная мотопехотная бригада)\", - говорится в сообщении.В ходе осмотра были обнаружены служебная документация, а также гранатометы NLAW, которые оставили покинувшие позицию украинские военнослужащие.О переходе Трехизбенки под контроль ЛНР в республике заявили 27 февраля - вскоре после начала российской спецоперации на Украине.\nhttps://ria.ru/20220411/kinzhal-1782987220.html\nhttps://ria.ru/20220413/donbass-1783278055.html\nроссия\nлуганская народная республика\nукраина\nРИА Новости\ninternet-group@rian.ru\n7 495 645-6601\nФГУП МИА «Россия сегодня»\nhttps://xn--c1acbl2abdlkab1og.xn--p1ai/awards/\n2022\nНовости\nru-RU\nhttps://ria.ru/docs/about/copyright.html\nhttps://xn--c1acbl2abdlkab1og.xn--p1ai/\nРИА Новости\ninternet-group@rian.ru\n7 495 645-6601\nФГУП МИА «Россия сегодня»\nhttps://xn--c1acbl2abdlkab1og.xn--p1ai/awards/\nhttps://cdnn21.img.ria.ru/images/07e6/04/0d/1783356066_240:0:1680:1080_1920x0_80_0_0_bf03688c08ce26167cafa5902841dd2a.jpg\nСледователи обнаружили в ЛНР временный пункт дислокации украинских войск\nВоенными следователями обнаружен временный пункт дислокации украинской войсковой части А4395\n2022-04-13T15:40\ntrue\nPT0M59S\nРИА Новости\ninternet-group@rian.ru\n7 495 645-6601\nФГУП МИА «Россия сегодня»\nhttps://xn--c1acbl2abdlkab1og.xn--p1ai/awards/\nроссия, луганская народная республика, украина, следственный комитет россии (ск рф), в мире\nСпециальная военная операция на Украине, Россия, Луганская Народная Республика, Украина, Следственный комитет России (СК РФ), В мире\n15:40 13.04.2022 (обновлено: 16:31 13.04.2022)\nСледователи нашли временный пункт дислокации ВСУ в Трехизбенке в ЛНР\nСледователи нашли временный пункт дислокации украинских войск в Трехизбенке в ЛНР",
    "lang": "ru",
    "document_type": "news",
    "tags": "",
    "country": null
}